1,"engineering",1,"I've done validation engineering for 5 years. Feel free to ask.",4,True
2,"computer science",1,"I'm pretty good at python.",4,False
2,"machine learning",2,"I use ML and GIS at work.",3,True
3,"writing",1,"I'm a published author who works as a lawyer by day.",4,True
3,"law",2,"The job that pays the bills. 10 years experience.",4,False
3,"art",3,"I'm just starting out, but I have accumulated a lot of resources to help fellow newbies out.",1,True
4,"medicine",1,"I've performed 1000 successful heart surgeries. AMA.",4,True
5,"networking",1,"I like to network. I can give you tips on how to get started.",4,True
5,"finance",2,"I'm in the finance industry for 2 years now.",2,True